[
  {
    "source_id": "cr-0001-not-development-first",
    "source_type": "manual_note",
    "platform_name": "Competitor A",
    "platform_category": ["scorekeeping", "stats", "team_management"],
    "source_platform": "web",
    "url": "internal://market-research-positioning.md#3-current-market-map",
    "date_published": null,
    "date_collected": "2026-06-09",
    "app_version": null,
    "rating": null,
    "review_title": null,
    "raw_text": null,
    "clean_text": "Competitor A dominates scoring, live updates, streaming, video, highlights, stats, and athlete profiles, and now adds AI lineup recommendations \u2014 but it is not a player-development operating system. It does not own season-long training progression, age-banded goals, or independent measurable tracking.",
    "author_role_inferred": "coach",
    "age_band": "unknown",
    "sport": "both",
    "workflow_stage": "post_game",
    "job_to_be_done": ["track_player_progress"],
    "pain_points": ["no_season_continuity", "no_player_owned_history"],
    "feature_requests": ["player_owned_profile", "team_development_dashboard", "age_band_benchmarks"],
    "delighters": [],
    "bugs_or_reliability_issues": [],
    "workarounds": [],
    "competitors_mentioned": ["competitor_a"],
    "pricing_feedback": [],
    "trust_or_safety_concerns": [],
    "data_ownership_concerns": ["no_player_owned_history"],
    "export_or_integration_needs": ["gamechanger_import"],
    "sentiment": "neutral",
    "urgency": "high",
    "severity": "medium",
    "confidence": "high",
    "product_implication": "Position around the missing layer, not against Competitor A: 'Competitor A tracks the game. We track the player.'",
    "opportunity_score": 36
  },
  {
    "source_id": "cr-0002-stats-but-now-what",
    "source_type": "manual_note",
    "platform_name": "Competitor A",
    "platform_category": ["stats"],
    "source_platform": "web",
    "url": "internal://market-research-positioning.md#4-customer-pain-signals",
    "date_published": null,
    "date_collected": "2026-06-09",
    "app_version": null,
    "rating": null,
    "review_title": null,
    "raw_text": null,
    "clean_text": "Coaches and parents see contact %, hard-hit %, QAB, K-rate, etc. in Competitor A and don't know what to DO with it. 'The stats are nice \u2014 but now what?' is the strongest recurring pain and the core product gap: there is no bridge from numbers to next actions.",
    "author_role_inferred": "parent",
    "age_band": "unknown",
    "sport": "both",
    "workflow_stage": "post_game",
    "job_to_be_done": ["track_player_progress", "assign_training_homework"],
    "pain_points": ["generic_training_plan"],
    "feature_requests": ["training_recommendations", "practice_plan_generator", "parent_progress_report", "skill_test_dashboard"],
    "delighters": [],
    "bugs_or_reliability_issues": [],
    "workarounds": [],
    "competitors_mentioned": ["competitor_a"],
    "pricing_feedback": [],
    "trust_or_safety_concerns": [],
    "data_ownership_concerns": [],
    "export_or_integration_needs": [],
    "sentiment": "negative",
    "urgency": "high",
    "severity": "high",
    "confidence": "high",
    "product_implication": "The translation layer ('this number means this, therefore do this next') is the single highest-leverage MVP bet.",
    "opportunity_score": 38
  },
  {
    "source_id": "cr-0003-youth-stats-drama-garbage",
    "source_type": "manual_note",
    "platform_name": "Competitor A",
    "platform_category": ["scorekeeping", "stats"],
    "source_platform": "web",
    "url": "internal://market-research-positioning.md#4-customer-pain-signals",
    "date_published": null,
    "date_collected": "2026-06-09",
    "app_version": null,
    "rating": null,
    "review_title": null,
    "raw_text": null,
    "clean_text": "Youth game stats create drama and are often garbage: errors scored as hits, kids over-focused on average, coaches editing stats. Building a development product on top of youth game stats inherits that noise.",
    "author_role_inferred": "coach",
    "age_band": "10U",
    "sport": "both",
    "workflow_stage": "post_game",
    "job_to_be_done": ["track_player_progress", "reduce_parent_complaints"],
    "pain_points": ["wrong_stats", "hard_to_fix_scoring"],
    "feature_requests": ["skill_test_dashboard", "age_band_benchmarks"],
    "delighters": [],
    "bugs_or_reliability_issues": [],
    "workarounds": [],
    "competitors_mentioned": ["competitor_a"],
    "pricing_feedback": [],
    "trust_or_safety_concerns": ["wrong_stats"],
    "data_ownership_concerns": [],
    "export_or_integration_needs": [],
    "sentiment": "negative",
    "urgency": "medium",
    "severity": "high",
    "confidence": "high",
    "product_implication": "Design around repeatable skill tests, personal progress, and coach-approved goals \u2014 NOT youth game stats.",
    "opportunity_score": 33
  },
  {
    "source_id": "cr-0004-fair-rotation-wedge",
    "source_type": "manual_note",
    "platform_name": "Competitor D",
    "platform_category": ["lineup"],
    "source_platform": "web",
    "url": "internal://competitor-research-corpus-plan.md#8-insights-we-expect-to-surface",
    "date_published": null,
    "date_collected": "2026-06-09",
    "app_version": null,
    "rating": null,
    "review_title": null,
    "raw_text": null,
    "clean_text": "A whole cluster of tools (Competitor D, Competitor F, Competitor G, Competitor Q, Competitor P) exist solely because coaches still struggle with fair playing time, infield/outfield rotation, bench tracking, and printable lineup cards. The persistent demand proves fair defensive rotation is a real, unsolved-at-quality wedge.",
    "author_role_inferred": "coach",
    "age_band": "10U",
    "sport": "both",
    "workflow_stage": "game_day",
    "job_to_be_done": ["create_fair_lineup", "balance_if_of_reps", "track_bench_time"],
    "pain_points": ["no_fairness_tracking", "high_coach_workload"],
    "feature_requests": ["fair_rotation_generator", "playing_time_ledger", "exportable_pdf"],
    "delighters": [],
    "bugs_or_reliability_issues": [],
    "workarounds": ["spreadsheets / whiteboards / clipboard charts"],
    "competitors_mentioned": ["competitor_d", "competitor_f", "competitor_g", "competitor_q", "competitor_p"],
    "pricing_feedback": [],
    "trust_or_safety_concerns": [],
    "data_ownership_concerns": [],
    "export_or_integration_needs": ["exportable_pdf"],
    "sentiment": "neutral",
    "urgency": "high",
    "severity": "medium",
    "confidence": "high",
    "product_implication": "Make fair rotation a core feature with season-long history: game-by-game grid, innings-by-position, bench count, IF/OF ratio, catcher innings, pitcher/catcher eligibility, parent-proof history, exportable PDF.",
    "opportunity_score": 35
  },
  {
    "source_id": "cr-0005-compliance-moat",
    "source_type": "product_page",
    "platform_name": "Competitor E",
    "platform_category": ["lineup", "stats"],
    "source_platform": "product_site",
    "url": "internal://competitor-research",
    "date_published": null,
    "date_collected": "2026-06-09",
    "app_version": null,
    "rating": null,
    "review_title": null,
    "raw_text": null,
    "clean_text": "Competitor E markets real-time pitch counting with automatic rest-day calculation, catcher-to-pitcher conflict flags, and automatic rule-compliance checking as the reason first-time coaches should choose it ('prevents mistakes new coaches don't know to watch for'). Pitch-count + compliance is now a competitor selling point, not a gap.",
    "author_role_inferred": "unknown",
    "age_band": "unknown",
    "sport": "both",
    "workflow_stage": "game_day",
    "job_to_be_done": ["track_pitch_count", "manage_pitcher_catcher_restrictions", "create_fair_lineup"],
    "pain_points": ["no_arm_care_guardrails"],
    "feature_requests": ["pitcher_catcher_restriction_assistant", "multi_game_tournament_planner"],
    "delighters": ["automatic rule-compliance checking", "rest-day calculation"],
    "bugs_or_reliability_issues": [],
    "workarounds": [],
    "competitors_mentioned": ["competitor_e", "competitor_p"],
    "pricing_feedback": ["free plan includes pitch counting + compliance"],
    "trust_or_safety_concerns": [],
    "data_ownership_concerns": [],
    "export_or_integration_needs": ["gamechanger_import"],
    "sentiment": "positive",
    "urgency": "high",
    "severity": "medium",
    "confidence": "high",
    "product_implication": "Pitch-count + compliance is now table stakes. Our differentiation must be REAL Pitch Smart rest-day enforcement (vs user-set caps) tied to the development loop, not just a counter.",
    "opportunity_score": 32
  },
  {
    "source_id": "cr-0006-free-tier-pressure",
    "source_type": "pricing_page",
    "platform_name": "Competitor E",
    "platform_category": ["lineup", "scorekeeping"],
    "source_platform": "product_site",
    "url": "internal://competitor-research",
    "date_published": null,
    "date_collected": "2026-06-09",
    "app_version": null,
    "rating": null,
    "review_title": null,
    "raw_text": null,
    "clean_text": "Competitor E's free plan already includes full game planning, pitch counting, playing-time tracking, scoring, and rule compliance, with AI/tournament/evaluations reserved for Pro. The coach-wedge feature set is being commoditized into a free tier.",
    "author_role_inferred": "unknown",
    "age_band": "unknown",
    "sport": "both",
    "workflow_stage": "pre_game",
    "job_to_be_done": ["create_fair_lineup", "track_pitch_count"],
    "pain_points": ["subscription_frustration"],
    "feature_requests": [],
    "delighters": ["generous free tier"],
    "bugs_or_reliability_issues": [],
    "workarounds": [],
    "competitors_mentioned": ["competitor_e"],
    "pricing_feedback": ["lineup + pitch-count + compliance free; AI/tournament/evaluations gated to Pro"],
    "trust_or_safety_concerns": [],